{
  "event_id": "8f14e45f-ceea-4b7a-9c1e-1a2b3c4d5e6f",
  "event_type": "academic.enrollment_accepted",
  "schema_version": 1,
  "tenant_id": "11111111-1111-4111-8111-111111111111",
  "occurred_at": "2026-09-11T08:30:00Z",
  "correlation_id": "22222222-2222-4222-8222-222222222222",
  "data": {
    "enrollment_id": "33333333-3333-4333-8333-333333333333",
    "student_id": "44444444-4444-4444-8444-444444444444",
    "program_id": "55555555-5555-4555-8555-555555555555",
    "term_id": "66666666-6666-4666-8666-666666666666"
  }
}
